{
  "record_type": "RoleKnowledgeBuiltinSourceRegistry",
  "schema_version": 1,
  "registry_id": "xb-role-knowledge-builtin-sources",
  "registry_version": "1.1.0",
  "captured_at": "2026-08-11T09:42:08Z",
  "ledger_file": "xbskill/references/specialty-source-ledger.md",
  "ledger_sha256": "c3ae45f80aac5a2811821a2d492e359cbe2fda8b8b5f260c461b3c94dbe131bf",
  "license_policies": {
    "functional-reimplementation-only": {
      "status": "approved",
      "scope": "facts_and_functional_relationships_only_no_verbatim_assets",
      "basis": "The exact upstream license or official-page boundary remains in the digest-bound ledger row; ambiguous reuse is limited to independently reimplemented functional relationships."
    }
  },
  "security_profiles": {
    "untrusted-reference-read-only": {
      "review_status": "reviewed",
      "content_policy": "untrusted_data_no_execute",
      "execution_authorized": false
    }
  },
  "sources": [
    {"id":"OFF-01","status":"activated","active_for_role_knowledge":true,"row_sha256":"4068372d9715986c94d285d0fdfb86e9c55b28e55e5515ddd669b68168bb4684","pin":{"kind":"retrieval_date","value":"2026-08-11"},"license_policy_id":"functional-reimplementation-only","security_profile_id":"untrusted-reference-read-only"},
    {"id":"OFF-02","status":"supporting","active_for_role_knowledge":false,"row_sha256":"d193355ce8de7ec71a623afe4901ee02b6c38ba12ea7f92870461c91c96d90b6","pin":{"kind":"retrieval_date","value":"2026-08-11"},"license_policy_id":"functional-reimplementation-only","security_profile_id":"untrusted-reference-read-only"},
    {"id":"OFF-D01","status":"activated","active_for_role_knowledge":true,"row_sha256":"f56f9eb69fccb815df33d05040c0524a1a0868a185068bae7fd9a20a92fbc657","pin":{"kind":"retrieval_date","value":"2026-08-11"},"license_policy_id":"functional-reimplementation-only","security_profile_id":"untrusted-reference-read-only"},
    {"id":"OFF-D02","status":"supporting","active_for_role_knowledge":false,"row_sha256":"9fd8ec1958f082528318fcf638edd02db5c791d1e986a2efc15254407807f9e2","pin":{"kind":"retrieval_date","value":"2026-08-11"},"license_policy_id":"functional-reimplementation-only","security_profile_id":"untrusted-reference-read-only"},
    {"id":"OFF-D03","status":"supporting","active_for_role_knowledge":false,"row_sha256":"9144de107f61f7aaa9051338ae68186a1a0be72ca83f0106ac0bff6fbf245579","pin":{"kind":"retrieval_date","value":"2026-08-11"},"license_policy_id":"functional-reimplementation-only","security_profile_id":"untrusted-reference-read-only"},
    {"id":"OFF-P01","status":"activated","active_for_role_knowledge":true,"row_sha256":"874e687172b0d50521ceb166897d2c39d345cbc1eb55e673c1f98ceb869da5de","pin":{"kind":"retrieval_date","value":"2026-08-11"},"license_policy_id":"functional-reimplementation-only","security_profile_id":"untrusted-reference-read-only"},
    {"id":"OFF-P02","status":"activated","active_for_role_knowledge":true,"row_sha256":"699cb42c7affaedc8cfb9aabdde86e1731b48f2b6cdf416dd7e6a1bbb6999187","pin":{"kind":"retrieval_date","value":"2026-08-11"},"license_policy_id":"functional-reimplementation-only","security_profile_id":"untrusted-reference-read-only"},
    {"id":"OFF-P03","status":"activated","active_for_role_knowledge":true,"row_sha256":"1226ccb49d9b8498b3ac808c2a34cd94421e4319e878dc9bfa77b4d455cb6f9b","pin":{"kind":"retrieval_date","value":"2026-08-11"},"license_policy_id":"functional-reimplementation-only","security_profile_id":"untrusted-reference-read-only"},
    {"id":"OFF-P04","status":"activated","active_for_role_knowledge":true,"row_sha256":"28875197719e5deb66a3740e3cb420a58eeabcd9f0ea44a44e36880cfea44c72","pin":{"kind":"retrieval_date","value":"2026-08-11"},"license_policy_id":"functional-reimplementation-only","security_profile_id":"untrusted-reference-read-only"},
    {"id":"OFF-P05","status":"supporting","active_for_role_knowledge":false,"row_sha256":"d7d4fae7588ac68ec30137308b43f19fabaa9db51c77421c1a4c6e9d2c38628f","pin":{"kind":"retrieval_date","value":"2026-08-11"},"license_policy_id":"functional-reimplementation-only","security_profile_id":"untrusted-reference-read-only"},
    {"id":"OFF-F01","status":"activated","active_for_role_knowledge":true,"row_sha256":"63f0db74e8ea4abe14285c03809c211f78abf00aa3b4d628588e78d09160e68d","pin":{"kind":"retrieval_date","value":"2026-08-11"},"license_policy_id":"functional-reimplementation-only","security_profile_id":"untrusted-reference-read-only"},
    {"id":"OFF-F02","status":"supporting","active_for_role_knowledge":true,"row_sha256":"a7d7013e8360c397a70788ff705e7aa09c2d44188a252ad210e34d2368c49c58","pin":{"kind":"retrieval_date","value":"2026-08-11"},"license_policy_id":"functional-reimplementation-only","security_profile_id":"untrusted-reference-read-only"},
    {"id":"OFF-F03","status":"activated","active_for_role_knowledge":true,"row_sha256":"6355395d3eb87fd79efbca854a4d3055f92d89167d9b33ef3b84e491a476931e","pin":{"kind":"retrieval_date","value":"2026-08-11"},"license_policy_id":"functional-reimplementation-only","security_profile_id":"untrusted-reference-read-only"},
    {"id":"OFF-F04","status":"activated","active_for_role_knowledge":false,"row_sha256":"fc20e1b31ff70b576eb415692537d3a9307370b3bf75a2f9b87f248003dd4d5d","pin":{"kind":"retrieval_date","value":"2026-08-11"},"license_policy_id":"functional-reimplementation-only","security_profile_id":"untrusted-reference-read-only"},
    {"id":"OFF-F05","status":"activated","active_for_role_knowledge":true,"row_sha256":"deb43957288975d20d813802ca5b83740205fa8c1b40040b1b6de787d00a31e0","pin":{"kind":"retrieval_date","value":"2026-08-11"},"license_policy_id":"functional-reimplementation-only","security_profile_id":"untrusted-reference-read-only"},
    {"id":"OFF-F06","status":"activated","active_for_role_knowledge":true,"row_sha256":"32365092d876a1e6d0763c7c16756b9fddff66b22a81987e38f79467faa26ae9","pin":{"kind":"retrieval_date","value":"2026-08-11"},"license_policy_id":"functional-reimplementation-only","security_profile_id":"untrusted-reference-read-only"},
    {"id":"OFF-O01","status":"activated","active_for_role_knowledge":true,"row_sha256":"2ce7b4cbeb037b1e6f2b3da4e05d493d0e479fb3f0a13e7248b43042686249c5","pin":{"kind":"retrieval_date","value":"2026-08-11"},"license_policy_id":"functional-reimplementation-only","security_profile_id":"untrusted-reference-read-only"},
    {"id":"OFF-O02","status":"activated","active_for_role_knowledge":true,"row_sha256":"e5dc74bbc0a339359a4a105d7ed02d798d7dab96f5091969d7ded50839bb9ea8","pin":{"kind":"retrieval_date","value":"2026-08-11"},"license_policy_id":"functional-reimplementation-only","security_profile_id":"untrusted-reference-read-only"},
    {"id":"OFF-O03","status":"activated","active_for_role_knowledge":false,"row_sha256":"7ed518c9339c02bd6bb2382bd85d27d91c97960a391fa00257809fc40caffc87","pin":{"kind":"retrieval_date","value":"2026-08-11"},"license_policy_id":"functional-reimplementation-only","security_profile_id":"untrusted-reference-read-only"},
    {"id":"OFF-O04","status":"activated","active_for_role_knowledge":false,"row_sha256":"9c3ebc07d00190ddc21d7628b3e57fb3a162390e42e454b80aa49e05379d0a46","pin":{"kind":"retrieval_date","value":"2026-08-11"},"license_policy_id":"functional-reimplementation-only","security_profile_id":"untrusted-reference-read-only"},
    {"id":"OFF-O05","status":"activated","active_for_role_knowledge":false,"row_sha256":"7dc68d8a9e729e81006023f39dffbe267ae3ff979f33072c6b747f2caa9246b5","pin":{"kind":"retrieval_date","value":"2026-08-11"},"license_policy_id":"functional-reimplementation-only","security_profile_id":"untrusted-reference-read-only"},
    {"id":"GH-D01","status":"activated","active_for_role_knowledge":true,"row_sha256":"7b452eec3e737aea1aa602331985cbcfd2f42615f422973faa4342c40d759a4f","pin":{"kind":"git_commit","value":"b6ba908404cea72e4ef5e1524e7809915693f2eb"},"license_policy_id":"functional-reimplementation-only","security_profile_id":"untrusted-reference-read-only"},
    {"id":"GH-D02","status":"activated","active_for_role_knowledge":true,"row_sha256":"a112d02f48f897cf6d81fdcea8906d8b78ae571cedcb793db9864638fbafde91","pin":{"kind":"git_commit","value":"1cf935be11b10b7eb664efec73bbc49e6daa84bb"},"license_policy_id":"functional-reimplementation-only","security_profile_id":"untrusted-reference-read-only"},
    {"id":"GH-D03","status":"activated","active_for_role_knowledge":true,"row_sha256":"abfe61d435b39f72ca370519e39f34fab81e698fcf29b82e4366f74d09c690c8","pin":{"kind":"git_commit","value":"655740bb98282ca64d5bde2aeec65da8c56b1930"},"license_policy_id":"functional-reimplementation-only","security_profile_id":"untrusted-reference-read-only"},
    {"id":"GH-D04","status":"activated","active_for_role_knowledge":true,"row_sha256":"6b6b3ee52620f4c9523370f7c3005e340396768475340f7ec3566879a03945b6","pin":{"kind":"git_commit","value":"39765c6ed0d44071d0d802169e568ed0bff10c41"},"license_policy_id":"functional-reimplementation-only","security_profile_id":"untrusted-reference-read-only"},
    {"id":"GH-D05","status":"activated","active_for_role_knowledge":true,"row_sha256":"f72766410e6c6e3ce1acc5ce54f391b68036fb5677807a66a432104d01f60fda","pin":{"kind":"git_commit","value":"7c5f2e767a7c1671be049cc56f77394627b4ba2f"},"license_policy_id":"functional-reimplementation-only","security_profile_id":"untrusted-reference-read-only"},
    {"id":"GH-D06","status":"activated","active_for_role_knowledge":true,"row_sha256":"4e4cb5ff60642bd6a200f131a4deaf644f6aeca215380789f192549dfcb95ade","pin":{"kind":"git_commit","value":"c5f2ba00b9cb63b95bf152e764f885690f82df18"},"license_policy_id":"functional-reimplementation-only","security_profile_id":"untrusted-reference-read-only"},